{
  "$schema": "https://flxforge.github.io/FLXEngine/schemas/object.schema.json",
  "origin": {
    "x": 320,
    "y": 240
  },
  "mechanics": {
    "type": "polar",
    "motion": {
      "speed": {
        "start": 200
      }
    },
    "rotation": {
      "angle": 25
    }
  },
  "group": "ball",
  "behavior": {
    "scripts": [
      "ball"
    ]
  },
  "sounds": {
    "paddle": {
      "kind": {
        "source": {
          "type": "oscillator",
          "wave": "square"
        },
        "note": 440
      },
      "duration": 0.08,
      "volume": 0.8
    }
  },
  "collisions": {
    "body": {
      "type": "ellipse",
      "size": {
        "width": 10,
        "height": 10
      },
      "with": [
        "wall_side",
        "wall_top",
        "title",
        "paddle"
      ]
    }
  },
  "size": {
    "width": 10,
    "height": 10
  },
  "visual": {
    "color": "white",
    "representation": [
      {
        "primitive": "ellipse",
        "mode": "fill"
      }
    ]
  }
}
