{
  "$schema": "https://flxforge.github.io/FLXEngine/schemas/object.schema.json",
  "mechanics": {
    "type": "polar",
    "motion": {
      "speed": {
        "start": 150
      }
    }
  },
  "inherit": {
    "creation": {
      "angle": "copy"
    }
  },
  "group": "enemy_missile",
  "behavior": {
    "scripts": [
      "enemy_missile"
    ]
  },
  "collisions": {
    "body": {
      "type": "box",
      "with": [
        "wall",
        "player"
      ]
    }
  },
  "size": {
    "width": 4,
    "height": 7
  },
  "visual": {
    "color": "#3A68B8",
    "representation": [
      {
        "primitive": "rectangle",
        "mode": "fill"
      }
    ]
  }
}