{
  "$schema": "https://flxforge.github.io/FLXEngine/schemas/object.schema.json",
  "bounds": {
    "mode": "wrap",
    "overflow": false
  },
  "mechanics": {
    "type": "polar",
    "rotation": {
      "speed": {
        "start": 180
      }
    }
  },
  "behavior": {
    "scripts": [
      "asteroid_fragment"
    ]
  },
  "size": {
    "width": 1,
    "height": 10
  },
  "visual": {
    "color": "orange",
    "representation": [
      {
        "geometry": [
          {
            "x": 0,
            "y": -5
          },
          {
            "x": 0,
            "y": 5
          }
        ],
        "mode": "open"
      }
    ]
  }
}
