{
  "$schema": "https://flxforge.github.io/FLXEngine/schemas/object.schema.json",
  "spawn": "manual",
  "states": {
    "initial": "intro",
    "intro": {
      "next": [
        "playing"
      ]
    },
    "playing": {
      "next": []
    }
  },
  "children": {
    "background": "common/background",
    "board": "common/board",
    "paddle": "common/paddle",
    "bricks": "level2/bricks"
  },
  "behavior": {
    "scripts": [
      "level"
    ]
  }
}
