{
  "group": "enemy",
  "collisions": {
    "body": {},
    "weakpoint": {
      "size": {
        "width": 8,
        "height": 8
      },
      "offset": {
        "x": 10,
        "y": -4
      }
    }
  },
  "size": {
    "width": 32,
    "height": 20
  },
  "visual": {
    "representation": [
      {
        "primitive": "rectangle"
      }
    ]
  }
}
