{
  "$schema": "https://flxforge.github.io/FLXEngine/schemas/object.schema.json",
  "offset": {
    "x": 7,
    "y": 5
  },
  "attach": {
    "born": true,
    "position": true
  },
  "children": {
    "laser": {
      "like": "laser",
      "spawn": "manual",
      "offset": {
        "x": 5,
        "y": 9
      }
    }
  },
  "group": "invader",
  "behavior": {
    "scripts": [
      "invader"
    ]
  },
  "collisions": {
    "body": {
      "type": "box"
    }
  },
  "size": {
    "width": 14,
    "height": 10
  },
  "visual": {
    "color": "green",
    "representation": [
      {
        "primitive": "rectangle",
        "mode": "fill"
      }
    ]
  }
}
