{
  "$schema": "https://flxforge.github.io/FLXEngine/schemas/object.schema.json",
  "origin": {
    "x": 335,
    "y": 275
  },
  "mechanics": {
    "type": "direct",
    "motion": {
      "speed": {
        "start": 200
      }
    }
  },
  "group": "paddle",
  "behavior": {
    "scripts": [
      "paddle"
    ]
  },
  "collisions": {
    "body": {
      "type": "box"
    }
  },
  "size": {
    "width": 70,
    "height": 10
  },
  "visual": {
    "color": "grey",
    "representation": [
      {
        "primitive": "rectangle",
        "mode": "fill"
      }
    ]
  }
}
