{
  "$schema": "https://flxforge.github.io/FLXEngine/schemas/object.schema.json",
  "mechanics": {
    "type": "polar",
    "motion": {
      "speed": {
        "start": 180
      }
    }
  },
  "behavior": {
    "scripts": [
      "tail"
    ]
  },
  "size": {
    "width": 6,
    "height": 8
  },
  "visual": {
    "color": "blue",
    "representation": [
      {
        "primitive": "triangle"
      }
    ]
  }
}
