{
  "$schema": "https://flxforge.github.io/FLXEngine/schemas/object.schema.json",
  "mechanics": {
    "type": "direct",
    "motion": {
      "inertia": 0.82
    },
    "rotation": {
      "speed": {
        "start": 30
      }
    }
  },
  "inherit": {
    "creation": {
      "velocity": "copy"
    }
  },
  "bounds": {
    "mode": "wrap",
    "overflow": false
  },
  "behavior": {
    "scripts": [
      "fragment"
    ]
  },
  "size": {
    "width": 1,
    "height": 20
  },
  "visual": {
    "color": "white",
    "representation": [
      {
        "geometry": [
          {
            "x": 0,
            "y": -10
          },
          {
            "x": 0,
            "y": 10
          }
        ],
        "mode": "open"
      }
    ]
  }
}
